commit	val_ap	peak_memory_gb	status	description	score	latency_ms	f1_score	samples_per_sec	total_seconds
8b6db50	0.5734	0.0	baseline	UNet BASE_CHANNELS=32 IMU_HIDDEN=128 focal_bce alpha=0.75 rate_reg=0.01 AMP per-channel
44f75f9	0.5619	0.0	discard	BASE_CHANNELS=48 LR=5e-4 (larger model + lower LR both hurt)
613a43c	0.5682	0.0	discard	BASE_CHANNELS=48 LR=1e-3 (larger model slower to converge in 15min)
9f72407	0.5718	0.0	discard	WEIGHT_DECAY=1e-4 (marginal, precision dropped)
afd2068	0.5651	0.0	discard	focal gamma=3.0 (stronger suppression, no precision improvement)
af37f9d	0.5720	0.0	discard	WARMUP=5% WARMDOWN=50% (closest so far, precision 0.497 vs 0.488)
87e7a3a	0.5757	0.0	keep	TOTAL_BATCH_SIZE=16 (2x gradient updates, +0.0023 over baseline)
4e07ef3	0.5742	0.0	discard	batch=16 + WARMUP=5% WARMDOWN=50% (didn't stack, worse than batch=16 alone)
f25d0dc	0.5776	0.0	keep	TOTAL_BATCH_SIZE=8 (4x gradient updates, +0.0019 over batch=16)
c5e423b	0.5865	0.0	keep	TOTAL_BATCH_SIZE=4 (no accum, max updates, +0.0089 over batch=8)
baf3a14	0.5842	0.0	discard	TOTAL_BATCH_SIZE=2 (too noisy, batch=4 is sweet spot)
30c443d	0.5555	0.0	discard	FNO model batch=4 (9.3M params, too slow to converge in 15min)
9371855	0.5787	0.0	discard	batch=4 LR=3e-4 (lower LR hurt, LR=1e-3 is optimal)
e6832f6	0.000000	0.0	crash	Best batch-size configuration with stronger AdamW regularization. failed
2913ad7	0.000000	0.0	crash	Retest the strongest scheduler shape on the best batch-size/LR baseline. failed
97f5243	0.000100	1.0	discard	Retest the strongest scheduler shape on the best batch-size/LR baseline.
e2c6037	0.000000	0.0	crash	Test mild AdamW regularization on the restored batch=4 LR=2e-3 baseline. failed
ecfd3ed	0.000100	1.0	discard	Retest the strongest scheduler shape on the restored batch=4 LR=2e-3 baseline.
56378cb	0.000100	1.0	discard	Test a slightly faster LR on the best batch=4 configuration.
9c10345	0.000100	1.6	discard	Optuna trial 509 exploring batch=8, device_batch=8, channels=32, imu_hidden=160, lr=0.00217983, wd=1e-05.
dbb1c41	0.000100	1.6	discard	Optuna trial 510 exploring batch=8, device_batch=8, channels=32, imu_hidden=160, lr=0.00217983, wd=1e-05.
efde145	0.000100	1.6	discard	Optuna trial 511 exploring batch=8, device_batch=8, channels=32, imu_hidden=160, lr=0.00217983, wd=1e-05.
020882e	0.000100	1.6	discard	Optuna trial 512 exploring batch=8, device_batch=8, channels=32, imu_hidden=160, lr=0.00217983, wd=1e-05.
2c2ae00	0.000000	0.0	skip	Optuna trial 749 exploring batch=8, device_batch=8, channels=32, imu_hidden=160, lr=0.00217983, wd=1e-05.
359083c	0.610500	1.6	keep	Optuna trial 750 exploring batch=4, device_batch=4, channels=32, imu_hidden=192, lr=0.00155123, wd=1e-05.
7d13976	0.624100	2.5	keep	Optuna trial 751 exploring batch=4, device_batch=4, channels=64, imu_hidden=128, lr=0.00228975, wd=1e-05.
306904f	0.619200	1.6	discard	Optuna trial 752 exploring batch=8, device_batch=8, channels=32, imu_hidden=192, lr=0.00269941, wd=0.0001.
f403b79	0.626600	2.5	keep	Optuna trial 753 exploring batch=4, device_batch=4, channels=64, imu_hidden=128, lr=0.00254881, wd=0.0003.
f052500	0.624400	2.0	discard	Optuna trial 754 exploring batch=8, device_batch=8, channels=48, imu_hidden=192, lr=0.001543, wd=1e-05.
9f42b5f	0.625400	2.5	discard	Optuna trial 755 exploring batch=4, device_batch=4, channels=64, imu_hidden=160, lr=0.00198465, wd=1e-05.
f25cea3	0.627300	3.2	keep	Optuna trial 756 exploring batch=16, device_batch=16, channels=64, imu_hidden=128, lr=0.000804827, wd=0.0003.
a7e64fd	0.632200	3.2	keep	Optuna trial 757 exploring batch=16, device_batch=16, channels=64, imu_hidden=128, lr=0.000710623, wd=0.0003.
a70907c	0.630600	3.2	discard	Optuna trial 758 exploring batch=16, device_batch=16, channels=64, imu_hidden=128, lr=0.000667642, wd=0.0003.
1723bb9	0.000000	0.0	crash	Optuna trial 760 exploring model=fno, fno_layers=2, fno_channels=160, fno_modes=10, batch=16, device_batch=16, channels=64, imu_hidden=128, lr=0.000506066, wd=0.0003.					
9e66302	0.000000	0.0	crash	Optuna trial 761 exploring model=fno, fno_layers=4, fno_channels=128, fno_modes=10, batch=16, device_batch=16, channels=64, imu_hidden=128, lr=0.000508727, wd=0.0003.					
f009ff8	0.629300	3.2	crash	Optuna trial 762 exploring model=fno, fno_layers=2, fno_channels=96, fno_modes=10, batch=16, device_batch=16, channels=64, imu_hidden=128, lr=0.000536349, wd=0.0003.		23.42	0.613300	42.700	909.50
3dea356	0.655900	5.5	keep	Optuna trial 763 exploring model=unet, family=heavy, fusion=additive, depth=3, batch=16, device_batch=16, channels=64, imu_hidden=128, lr=0.000516624, wd=0.0003.	0.680000	70.47	0.619900	14.200	919.00
c7275c8	0.654300	3.4	keep	Optuna trial 764 exploring model=unet, family=heavy, fusion=additive, depth=3, batch=16, device_batch=16, channels=48, imu_hidden=128, lr=0.000521519, wd=0.	0.693300	71.67	0.618600	14.000	919.50
afbaca8	0.657300	3.4	keep	Optuna trial 765 exploring model=unet, family=heavy, fusion=additive, depth=3, batch=16, device_batch=16, channels=48, imu_hidden=128, lr=0.000515931, wd=0.	0.695700	24.31	0.620100	41.100	909.40
ab31300	0.658800	3.4	keep	Optuna trial 766 exploring model=unet, family=heavy, fusion=additive, depth=3, batch=16, device_batch=16, channels=48, imu_hidden=128, lr=0.00105875, wd=0.	0.696400	23.68	0.620100	42.200	909.70
c285295	0.000000	0.0	crash	Optuna trial 767 exploring model=fno, fno_layers=4, fno_channels=96, fno_modes=6, batch=16, device_batch=16, channels=48, imu_hidden=128, lr=0.00104143, wd=0.					
cd17e86	0.000000	0.0	crash	Optuna trial 768 exploring model=fno, fno_layers=4, fno_channels=96, fno_modes=10, batch=16, device_batch=16, channels=48, imu_hidden=128, lr=0.00397262, wd=0.					
c419249	0.463500	3.5	discard	Optuna trial 769 exploring model=unet, family=heavy, fusion=additive, depth=4, batch=16, device_batch=16, channels=48, imu_hidden=128, lr=0.00379257, wd=0.	0.524700	105.91	0.409200	9.400	927.80
5368203	0.185500	7.4	discard	Optuna trial 770 exploring model=fno, fno_layers=6, fno_channels=160, fno_modes=8, batch=16, device_batch=16, channels=48, imu_hidden=128, lr=0.00101344, wd=0.	0.292100	51.07	0.213000	19.600	914.70
e72bc15	0.655900	3.4	discard	Optuna trial 771 exploring model=unet, family=balanced, fusion=film, depth=3, batch=16, device_batch=16, channels=48, imu_hidden=128, lr=0.00114929, wd=0.	0.694900	59.37	0.620600	16.800	917.30
7e8faeb	0.625000	3.4	discard	Optuna trial 773 exploring model=unet, family=light, fusion=gated, depth=2, batch=16, device_batch=16, channels=48, imu_hidden=192, lr=0.00100204, wd=0.	0.676000	23.64	0.610600	42.300	909.70
a128978	0.662600	3.4	keep	Optuna trial 774 exploring model=unet, family=balanced, fusion=film, depth=3, batch=16, device_batch=16, channels=48, imu_hidden=128, lr=0.00117938, wd=0.	0.699400	23.41	0.622900	42.700	909.70
aa13707	0.656400	3.4	discard	Optuna trial 775 exploring model=unet, family=balanced, fusion=film, depth=3, batch=16, device_batch=16, channels=48, imu_hidden=128, lr=0.0012712, wd=0.	0.695100	23.89	0.619800	41.900	910.10
d7804d0	0.000000	0.0	crash	Optuna trial 776 exploring model=fno, fno_layers=2, fno_channels=96, fno_modes=10, batch=16, device_batch=16, channels=48, imu_hidden=128, lr=0.000851519, wd=0.					
e645af1	0.000000	0.0	crash	Optuna trial 777 exploring model=fno, fno_layers=4, fno_channels=96, fno_modes=10, batch=16, device_batch=16, channels=48, imu_hidden=128, lr=0.00091426, wd=0.					
bc0ebe9	0.000000	0.0	crash	Optuna trial 778 exploring model=fno, fno_layers=2, fno_channels=96, fno_modes=6, batch=16, device_batch=16, channels=48, imu_hidden=128, lr=0.000916762, wd=0.					
8589ae2	0.000000	0.0	crash	Optuna trial 779 exploring model=fno, fno_layers=4, fno_channels=96, fno_modes=10, batch=16, device_batch=16, channels=48, imu_hidden=128, lr=0.000926621, wd=0.					
8cc0b71	0.000000	0.0	crash	Optuna trial 780 exploring model=fno, fno_layers=4, fno_channels=128, fno_modes=10, batch=16, device_batch=16, channels=48, imu_hidden=128, lr=0.00080283, wd=0.					
dbbd6f6	0.000000	0.0	crash	Optuna trial 781 exploring model=fno, fno_layers=4, fno_channels=96, fno_modes=10, batch=16, device_batch=16, channels=48, imu_hidden=128, lr=0.000855752, wd=0.					
1fa3965	0.000000	0.0	crash	Optuna trial 782 exploring model=fno, fno_layers=4, fno_channels=128, fno_modes=10, batch=16, device_batch=16, channels=48, imu_hidden=128, lr=0.000832447, wd=0.					
802ac0c	0.000000	0.0	crash	Optuna trial 783 exploring model=fno, fno_layers=4, fno_channels=96, fno_modes=10, batch=16, device_batch=16, channels=48, imu_hidden=128, lr=0.000849188, wd=0.					
8cdd8ff	0.000000	0.0	crash	Optuna trial 784 exploring model=fno, fno_layers=2, fno_channels=96, fno_modes=6, batch=16, device_batch=16, channels=48, imu_hidden=128, lr=0.000841891, wd=0.					
a9bcdfa	0.000000	0.0	crash	Optuna trial 785 exploring model=fno, fno_layers=2, fno_channels=128, fno_modes=6, batch=16, device_batch=16, channels=48, imu_hidden=128, lr=0.000897533, wd=0.					
7be0ceb	0.000000	0.0	crash	Optuna trial 786 exploring model=fno, fno_layers=2, fno_channels=128, fno_modes=10, batch=16, device_batch=16, channels=48, imu_hidden=128, lr=0.000908718, wd=0.					
136d9ab	0.000000	0.0	crash	Optuna trial 787 exploring model=fno, fno_layers=2, fno_channels=96, fno_modes=10, batch=16, device_batch=16, channels=48, imu_hidden=128, lr=0.000842352, wd=0.					
98541a4	0.000000	0.0	crash	Optuna trial 788 exploring model=fno, fno_layers=4, fno_channels=96, fno_modes=10, batch=16, device_batch=16, channels=48, imu_hidden=128, lr=0.000842756, wd=0.					
fe5483b	0.000000	0.0	crash	Optuna trial 789 exploring model=fno, fno_layers=2, fno_channels=96, fno_modes=6, batch=16, device_batch=16, channels=48, imu_hidden=128, lr=0.000853426, wd=0.					
72370e0	0.000000	0.0	crash	Optuna trial 790 exploring model=fno, fno_layers=4, fno_channels=96, fno_modes=10, batch=16, device_batch=16, channels=48, imu_hidden=128, lr=0.000880933, wd=0.					
4cdb5ca	0.000000	0.0	crash	Optuna trial 791 exploring model=fno, fno_layers=4, fno_channels=96, fno_modes=6, batch=16, device_batch=16, channels=48, imu_hidden=128, lr=0.000853949, wd=0.					
f44c508	0.000000	0.0	crash	Optuna trial 792 exploring model=fno, fno_layers=2, fno_channels=96, fno_modes=6, batch=16, device_batch=16, channels=48, imu_hidden=128, lr=0.000956518, wd=0.					
